{
  "cvd_policy": "0.1",
  "canonical": "https://example.com/.well-known/cvd.json",
  "expires": "2027-06-30T23:59:59Z",
  "updated": "2026-06-30",
  "organization": {
    "name": "Example Ltd.",
    "country": "DE",
    "role": "operator"
  },
  "contact": {
    "channels": [
      {
        "type": "email",
        "value": "security@example.com",
        "preferred": true
      }
    ],
    "languages": [
      "en",
      "de"
    ]
  },
  "research": {
    "posture": "limited",
    "statement": "Staging only."
  },
  "scope": {
    "precedence": "out_overrides_in",
    "web": [
      {
        "pattern": "staging.example.com",
        "state": "in"
      },
      {
        "pattern": "*.example.com",
        "state": "out",
        "reason": "not_operated"
      }
    ]
  },
  "report_requirements": {
    "required_fields": [
      "affected_asset",
      "description"
    ]
  },
  "testing": {
    "default": "prohibited",
    "rules": [
      {
        "activity": "manual_testing",
        "state": "allowed",
        "conditions": {
          "targets": [
            "staging.example.com"
          ],
          "account_request": "https://example.com/test-account"
        }
      },
      {
        "activity": "dos",
        "state": "prohibited"
      }
    ]
  }
}
