{
  "cvd_policy": "0.1",
  "canonical": "https://example.com/.well-known/cvd.json",
  "expires": "2027-06-30T23:59:59Z",
  "updated": "2026-06-30",
  "organization": {
    "name": "Example Ltd.",
    "country": "DE",
    "role": "operator"
  },
  "contact": {
    "channels": [
      {
        "type": "email",
        "value": "security@example.com",
        "preferred": true
      }
    ],
    "languages": [
      "en",
      "de"
    ]
  },
  "research": {
    "posture": "report_only"
  },
  "scope": {
    "precedence": "out_overrides_in",
    "products": [
      {
        "name": "SC-4000 Controller",
        "purl": "pkg:generic/example/sc4000",
        "versions": ">=2.0.0",
        "supported_until": "2030-12-31",
        "sbom": "https://example.com/sbom/sc4000.json"
      }
    ]
  },
  "report_requirements": {
    "required_fields": [
      "affected_asset",
      "description"
    ]
  }
}
