{
  "cvd_policy": "0.1",
  "canonical": "https://example.com/.well-known/cvd.json",
  "expires": "2027-06-30T23:59:59Z",
  "updated": "2026-06-30",
  "organization": {
    "name": "Example Ltd.",
    "country": "DE",
    "role": "operator"
  },
  "contact": {
    "channels": [
      {
        "type": "email",
        "value": "security@example.com",
        "preferred": true
      }
    ],
    "languages": [
      "en",
      "de"
    ]
  },
  "research": {
    "posture": "limited"
  },
  "scope": {
    "precedence": "out_overrides_in",
    "web": [
      {
        "pattern": "example.com",
        "state": "in"
      }
    ]
  },
  "report_requirements": {
    "required_fields": [
      "affected_asset",
      "description"
    ]
  },
  "testing": {
    "default": "prohibited",
    "rules": [
      {
        "activity": "automated_scanning",
        "state": "allowed",
        "conditions": {
          "max_requests_per_second": 2,
          "window": {
            "timezone": "Europe/Berlin",
            "days": [
              "mon",
              "tue",
              "wed",
              "thu",
              "fri"
            ],
            "from": "08:00",
            "to": "18:00"
          }
        }
      }
    ]
  }
}
