{
  "cvd_policy": "0.1",
  "canonical": "https://example.com/.well-known/cvd.json",
  "expires": "2027-06-30T23:59:59Z",
  "updated": "2026-06-30",
  "organization": {
    "name": "Example Control Systems Ltd.",
    "country": "DE",
    "role": "manufacturer",
    "url": "https://example.com"
  },
  "contact": {
    "channels": [
      { "type": "email", "value": "security@example.com", "preferred": true }
    ],
    "languages": ["en", "de"],
    "encryption": [
      {
        "type": "pgp",
        "value": "https://example.com/pgp-key.txt",
        "fingerprint": "3A1B 4C5D 6E7F 8091 A2B3  C4D5 E6F7 0819 2A3B 4C5D"
      }
    ],
    "response_target": {
      "acknowledge_within_hours": 48,
      "update_interval_days": 14
    }
  },
  "research": {
    "posture": "report_only",
    "statement": "Our equipment runs in production environments operated by third parties. We do not invite testing, because we do not operate the affected systems. Reports about vulnerabilities in our products are expressly welcome and will be acted upon."
  },
  "scope": {
    "precedence": "out_overrides_in",
    "web": [
      { "pattern": "example.com", "state": "in" },
      { "pattern": "shop.example.com", "state": "out", "reason": "third_party" },
      { "pattern": "alt.example.com", "state": "out", "reason": "legacy" }
    ],
    "products": [
      {
        "name": "SC-4000 Controller",
        "purl": "pkg:generic/example/sc4000",
        "versions": ">=2.0.0",
        "supported_until": "2030-12-31",
        "sbom": "https://example.com/sbom/sc4000.json"
      }
    ]
  },
  "report_requirements": {
    "required_fields": [
      "affected_asset",
      "description",
      "reproduction_steps",
      "impact"
    ],
    "proof_of_exploitation": "prohibited",
    "formats": ["text", "markdown", "pdf"],
    "max_attachment_mb": 20
  },
  "disclosure": {
    "model": "coordinated",
    "deadline_days": 90,
    "advisory_url": "https://example.com/security/advisories",
    "credit": "offered"
  }
}
